{
  "method": "publish",
  "id": 3,
  "params": {
    "channel": "/root/p_EYbHyMv6sopI5QhEXBf40MO_eNoq7V_LygBd4c9RA=",
    "message": {
      "data": "ewogICAgIm9iamVjdCI6ICJyb2xsX2NhbGwiLAogICAgImFjdGlvbiI6ICJjcmVhdGUiLAogICAgImlkIjogInBLYlhBU1pJNk5ZYnpoRktvR2Q0SFVwSUJMRi1DTVNHQWJmZFlrZDA5UE09IiwKICAgICJuYW1lIjogIlJvbGwgQ2FsbCAzIiwKICAgICJjcmVhdGlvbiI6IDE2MzMwOTg4NjQsCiAgICAicHJvcG9zZWRfc3RhcnQiOiAxNjMzMDk5MTI3LAogICAgInByb3Bvc2VkX2VuZCI6IDE2MzMwOTkxNDgsCiAgICAibG9jYXRpb24iOiAiTGF1c2FubmUiLAogICAgImRlc2NyaXB0aW9uIjogIk5pY2UgY2l0eSEiCn0=",
      "sender": "J9fBzJV70Jk5c-i3277Uq4CmeL4t53WDfUghaK0HpeM=",
      "signature": "ONylxgHA9cbsB_lwdfbn3iyzRd4aTpJhBMnvEKhmJF_niE_pUHdmjxDXjEwFyvo5WiH1NZXWyXG27SYEpkasCA==",
      "message_id": "5cc1e2ec977aff853342199b983fb6c7f1085f91a75761a345d9cb0cf09da068",
      "witness_signatures": []
    }
  },
  "jsonrpc": "2.0"
}
