{
  "jsonrpc": "2.0",
  "id": 4,
  "method": "publish",
  "params": {
    "channel": "/root/o3nyIIvrmDriwYXnH5-8CmYdyZcz4BPNT99W7dcrk9M=/coin",
    "message": {
      "data": "eyJvYmplY3QiOiJjb2luIiwiYWN0aW9uIjoicG9zdF90cmFuc2FjdGlvbiIsInRyYW5zYWN0aW9uIjp7InZlcnNpb24iOjEsImlucHV0cyI6W3sidHhfb3V0X2hhc2giOiJwaW8tR3VjaTFPb1NORHF3NUtGX3BqQUZBallhMjV2S2VXVm45emxrTTJvPSIsInR4X291dF9pbmRleCI6MCwic2NyaXB0Ijp7InR5cGUiOiJQMlBLSCIsInB1YmtleSI6Im5BSHJmbDluTFc5T09fc1JyMXE5bWtmZEFfU19pZzUxNTZhQU15a3pBdTA9Iiwic2lnIjoiQjNOTE82LV9EdTJ3Sy1ubFFsUU5XUm1aNG1sTVVMNTBmeFhyaWNLaHktRkMwSUV5YnR2NDhQWnVVdGZXZC1LNFo2YUcxakFUWDRodk1LNHEybi1qQUE9PSJ9fSx7InR4X291dF9oYXNoIjoiWTRTVm1LcTFPdG84ZmVfS1ZMUlpBV0QxLWwyWmJkb0ZnU2E4VmVlMEtSMD0iLCJ0eF9vdXRfaW5kZXgiOjAsInNjcmlwdCI6eyJ0eXBlIjoiUDJQS0giLCJwdWJrZXkiOiJuQUhyZmw5bkxXOU9PX3NScjFxOW1rZmRBX1NfaWc1MTU2YUFNeWt6QXUwPSIsInNpZyI6IkIzTkxPNi1fRHUyd0stbmxRbFFOV1JtWjRtbE1VTDUwZnhYcmljS2h5LUZDMElFeWJ0djQ4UFp1VXRmV2QtSzRaNmFHMWpBVFg0aHZNSzRxMm4takFBPT0ifX1dLCJvdXRwdXRzIjpbeyJ2YWx1ZSI6NTAsInNjcmlwdCI6eyJ0eXBlIjoiUDJQS0giLCJwdWJrZXlfaGFzaCI6IjRfRXl6cFRDQllkZmpTMXpmTGFERUtxSUthMD0ifX0seyJ2YWx1ZSI6MTAwLCJzY3JpcHQiOnsidHlwZSI6IlAyUEtIIiwicHVia2V5X2hhc2giOiI0X0V5enBUQ0JZZGZqUzF6ZkxhREVLcUlLYTA9In19XSwibG9ja190aW1lIjowfSwidHJhbnNhY3Rpb25faWQiOiJkU3NZeDdRdzFMdXE3a1phLTV0RXU3dllIbG5qTC1jNENsbTVnZHh3ODdJPSJ9",
      "message_id": "5hWtZA3q-b7bmCP33wZQKfYmiRXmZEAjlAV3NrDQNW4=",
      "sender": "Uuvr9cFe0r7j8f64aPvrk7Z65Jt4kv9nGz4HXgoy38Q=",
      "signature": "B3T-FIBsymtCKn2aDhM-W37CPiOszfCziR-MXMV2swLQl46hMdcqleljjXi6cyXwYhhAU1t6dnailaLQKnJgBw==",
      "witness_signatures": []
    }
  }
}
