{
  "method": "publish",
  "id": 33,
  "params": {
    "channel": "/root/p_EYbHyMv6sopI5QhEXBf40MO_eNoq7V_LygBd4c9RA=",
    "message": {
      "data": "ewogICJvYmplY3QiOiAicm9sbF9jYWxsIiwKICAiYWN0aW9uIjogImNsb3NlIiwKICAidXBkYXRlX2lkIjogIklHTEIzcGlwSzBwMEc1RV93RnhlZEVrNElweU0zTDdYSVFvRnVtbWhqMFk9IiwKICAiY2xvc2VzIjogIlZTc1JyY0hvT1RRSi1uVV9WVF9GYWtpTWtlelpBODZ6MlVITlpLQ3hiTjg9IiwKICAiY2xvc2VkX2F0IjogMTYzMzA5OTEzNSwKICAiYXR0ZW5kZWVzIjogWyJNNVp5Y2hFaTVyd20yMkZqd2pOdWxqTDFxTUpXRDJzRTdvWDlmY0hOTURVPSJdCn0=",
      "sender": "J9fBzJV70Jk5c-i3277Uq4CmeL4t53WDfUghaK0HpeM=",
      "signature": "ONylxgHA9cbsB_lwdfbn3iyzRd4aTpJhBMnvEKhmJF_niE_pUHdmjxDXjEwFyvo5WiH1NZXWyXG27SYEpkasCA==",
      "message_id": "ede55c05d3bdfb7a5247926d361d7844b4f4ca4efde3347dbe4460dbcaec9ad6",
      "witness_signatures": []
    }
  },
  "jsonrpc": "2.0"
}
