{
  "method": "publish",
  "id": 3,
  "params": {
    "channel": "/root/p_EYbHyMv6sopI5QhEXBf40MO_eNoq7V_LygBd4c9RA=",
    "message": {
      "data": "ewogICAgIm9iamVjdCI6ICJyb2xsX2NhbGwiLAogICAgImFjdGlvbiI6ICJjcmVhdGUiLAogICAgImlkIjogIlZTc1JyY0hvT1RRSi1uVV9WVF9GYWtpTWtlelpBODZ6MlVITlpLQ3hiTjg9IiwKICAgICJuYW1lIjogIlJvbGwgQ2FsbCAyIiwKICAgICJjcmVhdGlvbiI6IDE2MzMwOTg4NjMsCiAgICAicHJvcG9zZWRfc3RhcnQiOiAxNjMzMDk5MTI2LAogICAgInByb3Bvc2VkX2VuZCI6IDE2MzMwOTkxNDEsCiAgICAibG9jYXRpb24iOiAiRVBGTCBjYWZldGVyaWEiLAogICAgImRlc2NyaXB0aW9uIjogIkZvb2QgaXMgd2VsY29tZSBhbnl0aW1lISIKfQ==",
      "sender": "J9fBzJV70Jk5c-i3277Uq4CmeL4t53WDfUghaK0HpeM=",
      "signature": "ONylxgHA9cbsB_lwdfbn3iyzRd4aTpJhBMnvEKhmJF_niE_pUHdmjxDXjEwFyvo5WiH1NZXWyXG27SYEpkasCA==",
      "message_id": "0c01b56210be3d7a63c18464035a9ddec58e3953286139293422b548bf36acee",
      "witness_signatures": []
    }
  },
  "jsonrpc": "2.0"
}
