{
  "jsonrpc": "2.0",
  "id": 4,
  "method": "publish",
  "params": {
    "channel": "/root/o3nyIIvrmDriwYXnH5-8CmYdyZcz4BPNT99W7dcrk9M=/coin",
    "message": {
      "data": "eyJvYmplY3QiOiJjb2luIiwiYWN0aW9uIjoicG9zdF90cmFuc2FjdGlvbiIsInRyYW5zYWN0aW9uIjp7InZlcnNpb24iOjEsImlucHV0cyI6W3sidHhfb3V0X2hhc2giOiJkU3NZeDdRdzFMdXE3a1phLTV0RXU3dllIbG5qTC1jNENsbTVnZHh3ODdJPSIsInR4X291dF9pbmRleCI6MCwic2NyaXB0Ijp7InR5cGUiOiJQMlBLSCIsInB1YmtleSI6Im5BSHJmbDluTFc5T09fc1JyMXE5bWtmZEFfU19pZzUxNTZhQU15a3pBdTA9Iiwic2lnIjoidjJERzVOUFREcF9UV1FGbVEwSXc1M1hqblpRUFF6YXRUaEhicmVjWUdkS2hhRkRlMEkwbU5KWlJUQ3lKOGs2MGtsNnRwaG9CMzlib0hKRkhlNHdvQVE9PSJ9fSx7InR4X291dF9oYXNoIjoiZFNzWXg3UXcxTHVxN2taYS01dEV1N3ZZSGxuakwtYzRDbG01Z2R4dzg3ST0iLCJ0eF9vdXRfaW5kZXgiOjEsInNjcmlwdCI6eyJ0eXBlIjoiUDJQS0giLCJwdWJrZXkiOiJuQUhyZmw5bkxXOU9PX3NScjFxOW1rZmRBX1NfaWc1MTU2YUFNeWt6QXUwPSIsInNpZyI6InYyREc1TlBURHBfVFdRRm1RMEl3NTNYam5aUVBRemF0VGhIYnJlY1lHZEtoYUZEZTBJMG1OSlpSVEN5SjhrNjBrbDZ0cGhvQjM5Ym9ISkZIZTR3b0FRPT0ifX0seyJ0eF9vdXRfaGFzaCI6ImRTc1l4N1F3MUx1cTdrWmEtNXRFdTd2WUhsbmpMLWM0Q2xtNWdkeHc4N0k9IiwidHhfb3V0X2luZGV4IjowLCJzY3JpcHQiOnsidHlwZSI6IlAyUEtIIiwicHVia2V5IjoibkFIcmZsOW5MVzlPT19zUnIxcTlta2ZkQV9TX2lnNTE1NmFBTXlrekF1MD0iLCJzaWciOiJ2MkRHNU5QVERwX1RXUUZtUTBJdzUzWGpuWlFQUXphdFRoSGJyZWNZR2RLaGFGRGUwSTBtTkpaUlRDeUo4azYwa2w2dHBob0IzOWJvSEpGSGU0d29BUT09In19LHsidHhfb3V0X2hhc2giOiJkU3NZeDdRdzFMdXE3a1phLTV0RXU3dllIbG5qTC1jNENsbTVnZHh3ODdJPSIsInR4X291dF9pbmRleCI6MSwic2NyaXB0Ijp7InR5cGUiOiJQMlBLSCIsInB1YmtleSI6Im5BSHJmbDluTFc5T09fc1JyMXE5bWtmZEFfU19pZzUxNTZhQU15a3pBdTA9Iiwic2lnIjoidjJERzVOUFREcF9UV1FGbVEwSXc1M1hqblpRUFF6YXRUaEhicmVjWUdkS2hhRkRlMEkwbU5KWlJUQ3lKOGs2MGtsNnRwaG9CMzlib0hKRkhlNHdvQVE9PSJ9fV0sIm91dHB1dHMiOlt7InZhbHVlIjo1MCwic2NyaXB0Ijp7InR5cGUiOiJQMlBLSCIsInB1YmtleV9oYXNoIjoib3ljejhkNXp0QUZTTHpYLVVESWpRbzhpSEZJPSJ9fSx7InZhbHVlIjoxMDAsInNjcmlwdCI6eyJ0eXBlIjoiUDJQS0giLCJwdWJrZXlfaGFzaCI6IjRfRXl6cFRDQllkZmpTMXpmTGFERUtxSUthMD0ifX1dLCJsb2NrX3RpbWUiOjB9LCJ0cmFuc2FjdGlvbl9pZCI6InBLOHF4X3doUktjbGoyMXFSRjlWZWJ5NnNoWk02V25rYTdwbHdPLW0zRDQ9In0=",
      "message_id": "SpexxR28mMd8GU40As8ASex44YHAH0rLsENvhj-7wJ0=",
      "sender": "Uuvr9cFe0r7j8f64aPvrk7Z65Jt4kv9nGz4HXgoy38Q=",
      "signature": "8xBeUuLWJ58sir2CLnWXmLaxIX8xQ-H-G6Rctg_OuDH6vBRKnXX0zMvHxvwK92YPwQM1OvgcyR7WE52uj13lCw==",
      "witness_signatures": []
    }
  }
}
