{
  "method": "publish",
  "id": 32,
  "params": {
    "channel": "/root/p_EYbHyMv6sopI5QhEXBf40MO_eNoq7V_LygBd4c9RA=",
    "message": {
      "data": "ewogICJvYmplY3QiOiAicm9sbF9jYWxsIiwKICAiYWN0aW9uIjogIm9wZW4iLAogICJ1cGRhdGVfaWQiOiAia3JDSGg2T0ZXSWpTSFFpVVNyV3l4MUZWMEpwOGRlQzN6VXllbGhQRy1Zaz0iLAogICJvcGVucyI6ICJmRXZBZmR0TnJ5a2Q5TlBZbDlSZUhMWC02SVA2U0ZMS1RaSkxlR1VIWl9VPSIsCiAgIm9wZW5lZF9hdCI6IDE2MzMwOTkxMjcKfQ==",
      "sender": "J9fBzJV70Jk5c-i3277Uq4CmeL4t53WDfUghaK0HpeM=",
      "signature": "ONylxgHA9cbsB_lwdfbn3iyzRd4aTpJhBMnvEKhmJF_niE_pUHdmjxDXjEwFyvo5WiH1NZXWyXG27SYEpkasCA==",
      "message_id": "3ce19889ff3355a833bb27f1748f81ace6b91d333ceb4d3c58776c011790f69f",
      "witness_signatures": []
    }
  },
  "jsonrpc": "2.0"
}
